line,id,source_file,type,course_code,decision,issues,question,answer
1500,ACE6153-09,faie_full_qa.jsonl,,ACE6153,review,repeated_answer_template,What skills or outcomes can a student expect from ACE6153 (Operating Systems)?,"To provide students with comprehensive understanding of operating systems design, implementation, and management."
1501,ACE6153-10,faie_full_qa.jsonl,,ACE6153,cut_or_rewrite,low_user_value_question,Where in the original PDF is ACE6153 (Operating Systems) listed?,"Original PDF page(s) recorded in the cleaned catalog: 5, 16, 17"
1502,ACE6163-01,faie_full_qa.jsonl,,ACE6163,review,repeated_answer_template,What is ACE6163 (Microcontroller and Microprocessor Systems) about?,To provide students with practical knowledge of microcontroller and microprocessor systems design and programming.
1503,ACE6163-02,faie_full_qa.jsonl,,ACE6163,review,too_short_answer;repeated_answer_template;numeric_answer_needs_context,How many credits is ACE6163 (Microcontroller and Microprocessor Systems)?,3
1504,ACE6163-03,faie_full_qa.jsonl,,ACE6163,cut_or_rewrite,placeholder_or_non_answer;repeated_answer_template,What are the prerequisites for ACE6163 (Microcontroller and Microprocessor Systems)?,No prerequisites were detected in the catalog excerpt.
1505,ACE6163-04,faie_full_qa.jsonl,,ACE6163,review,repeated_answer_template,What is the main objective of ACE6163 (Microcontroller and Microprocessor Systems)?,To provide students with practical knowledge of microcontroller and microprocessor systems design and programming.
1506,ACE6163-05,faie_full_qa.jsonl,,ACE6163,keep,,How is ACE6163 (Microcontroller and Microprocessor Systems) assessed?,"Test/Quiz: 20%, Assignment: 30%, Final Examination: 50% Laboratory: Advanced microprocessor design and simulation labs"
1507,ACE6163-06,faie_full_qa.jsonl,,ACE6163,review,repeated_answer_template,What are the contact hours for ACE6163 (Microcontroller and Microprocessor Systems)?,"44 hours (lectures, tutorials and laboratory experiments)"
1508,ACE6163-07,faie_full_qa.jsonl,,ACE6163,keep,,What key contents/topics are covered in ACE6163 (Microcontroller and Microprocessor Systems)?,"actuators, wireless communication protocols, IoT platforms, cloud integration, IoT applications and security. Course Learning CO1 – Understand embedded systems and IoT concepts (cognitive –"
1509,ACE6163-08,faie_full_qa.jsonl,,ACE6163,review,repeated_answer_template,Is ACE6163 (Microcontroller and Microprocessor Systems) more theory-based or includes practical/lab work?,The catalog excerpt indicates laboratory/practical components where listed under assessment or contact hours. This excerpt includes lab/practical mentions.
1510,ACE6163-09,faie_full_qa.jsonl,,ACE6163,review,repeated_answer_template,What skills or outcomes can a student expect from ACE6163 (Microcontroller and Microprocessor Systems)?,To provide students with practical knowledge of microcontroller and microprocessor systems design and programming.
1511,ACE6163-10,faie_full_qa.jsonl,,ACE6163,cut_or_rewrite,low_user_value_question,Where in the original PDF is ACE6163 (Microcontroller and Microprocessor Systems) listed?,"Original PDF page(s) recorded in the cleaned catalog: 6, 7, 13"
1512,ACE6173-01,faie_full_qa.jsonl,,ACE6173,review,repeated_answer_template,What is ACE6173 (Software Engineering) about?,To provide the students with an understanding of theoretical and practical foundation of software engineering.
1513,ACE6173-02,faie_full_qa.jsonl,,ACE6173,review,too_short_answer;repeated_answer_template;numeric_answer_needs_context,How many credits is ACE6173 (Software Engineering)?,3
1514,ACE6173-03,faie_full_qa.jsonl,,ACE6173,cut_or_rewrite,placeholder_or_non_answer;repeated_answer_template,What are the prerequisites for ACE6173 (Software Engineering)?,No prerequisites were detected in the catalog excerpt.
1515,ACE6173-04,faie_full_qa.jsonl,,ACE6173,review,repeated_answer_template,What is the main objective of ACE6173 (Software Engineering)?,To provide the students with an understanding of theoretical and practical foundation of software engineering.
1516,ACE6173-05,faie_full_qa.jsonl,,ACE6173,keep,,How is ACE6173 (Software Engineering) assessed?,"Tutorial/Assignment: 20%, Test/Quiz: 20%, Final Examination: 60% Course Principles of software engineering. Software life cycle. Introduction."
1517,ACE6173-06,faie_full_qa.jsonl,,ACE6173,keep,,What are the contact hours for ACE6173 (Software Engineering)?,48 hours (lectures & tutorials)
1518,ACE6173-07,faie_full_qa.jsonl,,ACE6173,keep,,What key contents/topics are covered in ACE6173 (Software Engineering)?,Requirements and Specification. Software Design. Verification and Validation. Project Management. Course Learning CO1 – Differentiate the various software engineering development lifecycle
1519,ACE6173-08,faie_full_qa.jsonl,,ACE6173,review,repeated_answer_template,Is ACE6173 (Software Engineering) more theory-based or includes practical/lab work?,The catalog excerpt indicates laboratory/practical components where listed under assessment or contact hours. Specific lab/practical details are not clearly stated in the excerpt.
1520,ACE6173-09,faie_full_qa.jsonl,,ACE6173,review,repeated_answer_template,What skills or outcomes can a student expect from ACE6173 (Software Engineering)?,To provide the students with an understanding of theoretical and practical foundation of software engineering.
1521,ACE6173-10,faie_full_qa.jsonl,,ACE6173,cut_or_rewrite,low_user_value_question,Where in the original PDF is ACE6173 (Software Engineering) listed?,"Original PDF page(s) recorded in the cleaned catalog: 6, 7"
1522,ACE6183-01,faie_full_qa.jsonl,,ACE6183,review,repeated_answer_template,What is ACE6183 (Advanced Microprocessors) about?,"To provide advanced knowledge of microprocessor design, architecture, and optimization techniques."
1523,ACE6183-02,faie_full_qa.jsonl,,ACE6183,review,too_short_answer;repeated_answer_template;numeric_answer_needs_context,How many credits is ACE6183 (Advanced Microprocessors)?,3
1524,ACE6183-03,faie_full_qa.jsonl,,ACE6183,cut_or_rewrite,placeholder_or_non_answer;repeated_answer_template,What are the prerequisites for ACE6183 (Advanced Microprocessors)?,No prerequisites were detected in the catalog excerpt.
1525,ACE6183-04,faie_full_qa.jsonl,,ACE6183,review,repeated_answer_template,What is the main objective of ACE6183 (Advanced Microprocessors)?,"To provide advanced knowledge of microprocessor design, architecture, and optimization techniques."
1526,ACE6183-05,faie_full_qa.jsonl,,ACE6183,cut_or_rewrite,placeholder_or_non_answer;repeated_answer_template,How is ACE6183 (Advanced Microprocessors) assessed?,Not specified in the provided FAIE course catalog excerpt.
1527,ACE6183-06,faie_full_qa.jsonl,,ACE6183,cut_or_rewrite,placeholder_or_non_answer;repeated_answer_template,What are the contact hours for ACE6183 (Advanced Microprocessors)?,Not specified in the provided FAIE course catalog excerpt.
1528,ACE6183-07,faie_full_qa.jsonl,,ACE6183,cut_or_rewrite,placeholder_or_non_answer;repeated_answer_template,What key contents/topics are covered in ACE6183 (Advanced Microprocessors)?,Not specified in the provided FAIE course catalog excerpt.
1529,ACE6183-08,faie_full_qa.jsonl,,ACE6183,review,repeated_answer_template,Is ACE6183 (Advanced Microprocessors) more theory-based or includes practical/lab work?,The catalog excerpt indicates laboratory/practical components where listed under assessment or contact hours. Specific lab/practical details are not clearly stated in the excerpt.
1530,ACE6183-09,faie_full_qa.jsonl,,ACE6183,review,repeated_answer_template,What skills or outcomes can a student expect from ACE6183 (Advanced Microprocessors)?,"To provide advanced knowledge of microprocessor design, architecture, and optimization techniques."
1531,ACE6183-10,faie_full_qa.jsonl,,ACE6183,cut_or_rewrite,low_user_value_question,Where in the original PDF is ACE6183 (Advanced Microprocessors) listed?,Original PDF page(s) recorded in the cleaned catalog: 7
1532,ACE6193-01,faie_full_qa.jsonl,,ACE6193,review,repeated_answer_template,What is ACE6193 (Object Oriented Programming with C++) about?,To teach students object-oriented programming concepts and practical implementation using C++.
1533,ACE6193-02,faie_full_qa.jsonl,,ACE6193,review,too_short_answer;repeated_answer_template;numeric_answer_needs_context,How many credits is ACE6193 (Object Oriented Programming with C++)?,3
1534,ACE6193-03,faie_full_qa.jsonl,,ACE6193,cut_or_rewrite,placeholder_or_non_answer;repeated_answer_template,What are the prerequisites for ACE6193 (Object Oriented Programming with C++)?,No prerequisites were detected in the catalog excerpt.
1535,ACE6193-04,faie_full_qa.jsonl,,ACE6193,review,repeated_answer_template,What is the main objective of ACE6193 (Object Oriented Programming with C++)?,To teach students object-oriented programming concepts and practical implementation using C++.
1536,ACE6193-05,faie_full_qa.jsonl,,ACE6193,cut_or_rewrite,placeholder_or_non_answer;repeated_answer_template,How is ACE6193 (Object Oriented Programming with C++) assessed?,Not specified in the provided FAIE course catalog excerpt.
1537,ACE6193-06,faie_full_qa.jsonl,,ACE6193,cut_or_rewrite,placeholder_or_non_answer;repeated_answer_template,What are the contact hours for ACE6193 (Object Oriented Programming with C++)?,Not specified in the provided FAIE course catalog excerpt.
1538,ACE6193-07,faie_full_qa.jsonl,,ACE6193,cut_or_rewrite,placeholder_or_non_answer;repeated_answer_template,What key contents/topics are covered in ACE6193 (Object Oriented Programming with C++)?,Not specified in the provided FAIE course catalog excerpt.
1539,ACE6193-08,faie_full_qa.jsonl,,ACE6193,review,repeated_answer_template,Is ACE6193 (Object Oriented Programming with C++) more theory-based or includes practical/lab work?,The catalog excerpt indicates laboratory/practical components where listed under assessment or contact hours. Specific lab/practical details are not clearly stated in the excerpt.
1540,ACE6193-09,faie_full_qa.jsonl,,ACE6193,review,repeated_answer_template,What skills or outcomes can a student expect from ACE6193 (Object Oriented Programming with C++)?,To teach students object-oriented programming concepts and practical implementation using C++.
1541,ACE6193-10,faie_full_qa.jsonl,,ACE6193,cut_or_rewrite,low_user_value_question,Where in the original PDF is ACE6193 (Object Oriented Programming with C++) listed?,Original PDF page(s) recorded in the cleaned catalog: 8
1542,ACE6203-01,faie_full_qa.jsonl,,ACE6203,review,repeated_answer_template,What is ACE6203 (Digital Computer Design) about?,To provide students with knowledge of digital computer design principles and implementation.
1543,ACE6203-02,faie_full_qa.jsonl,,ACE6203,review,too_short_answer;repeated_answer_template;numeric_answer_needs_context,How many credits is ACE6203 (Digital Computer Design)?,3
1544,ACE6203-03,faie_full_qa.jsonl,,ACE6203,cut_or_rewrite,placeholder_or_non_answer;repeated_answer_template,What are the prerequisites for ACE6203 (Digital Computer Design)?,No prerequisites were detected in the catalog excerpt.
1545,ACE6203-04,faie_full_qa.jsonl,,ACE6203,review,repeated_answer_template,What is the main objective of ACE6203 (Digital Computer Design)?,To provide students with knowledge of digital computer design principles and implementation.
1546,ACE6203-05,faie_full_qa.jsonl,,ACE6203,cut_or_rewrite,placeholder_or_non_answer;repeated_answer_template,How is ACE6203 (Digital Computer Design) assessed?,Not specified in the provided FAIE course catalog excerpt.
1547,ACE6203-06,faie_full_qa.jsonl,,ACE6203,cut_or_rewrite,placeholder_or_non_answer;repeated_answer_template,What are the contact hours for ACE6203 (Digital Computer Design)?,Not specified in the provided FAIE course catalog excerpt.
1548,ACE6203-07,faie_full_qa.jsonl,,ACE6203,cut_or_rewrite,placeholder_or_non_answer;repeated_answer_template,What key contents/topics are covered in ACE6203 (Digital Computer Design)?,Not specified in the provided FAIE course catalog excerpt.
1549,ACE6203-08,faie_full_qa.jsonl,,ACE6203,review,repeated_answer_template,Is ACE6203 (Digital Computer Design) more theory-based or includes practical/lab work?,The catalog excerpt indicates laboratory/practical components where listed under assessment or contact hours. Specific lab/practical details are not clearly stated in the excerpt.
1550,ACE6203-09,faie_full_qa.jsonl,,ACE6203,review,repeated_answer_template,What skills or outcomes can a student expect from ACE6203 (Digital Computer Design)?,To provide students with knowledge of digital computer design principles and implementation.
1551,ACE6203-10,faie_full_qa.jsonl,,ACE6203,cut_or_rewrite,low_user_value_question,Where in the original PDF is ACE6203 (Digital Computer Design) listed?,"Original PDF page(s) recorded in the cleaned catalog: 8, 9"
1552,ACE6213-01,faie_full_qa.jsonl,,ACE6213,review,repeated_answer_template,What is ACE6213 (CyberSecurity) about?,"To provide students with comprehensive knowledge of cybersecurity principles, threats, and defense mechanisms."
1553,ACE6213-02,faie_full_qa.jsonl,,ACE6213,review,too_short_answer;repeated_answer_template;numeric_answer_needs_context,How many credits is ACE6213 (CyberSecurity)?,3
1554,ACE6213-03,faie_full_qa.jsonl,,ACE6213,cut_or_rewrite,placeholder_or_non_answer;repeated_answer_template,What are the prerequisites for ACE6213 (CyberSecurity)?,No prerequisites were detected in the catalog excerpt.
1555,ACE6213-04,faie_full_qa.jsonl,,ACE6213,review,repeated_answer_template,What is the main objective of ACE6213 (CyberSecurity)?,"To provide students with comprehensive knowledge of cybersecurity principles, threats, and defense mechanisms."
1556,ACE6213-05,faie_full_qa.jsonl,,ACE6213,cut_or_rewrite,placeholder_or_non_answer;repeated_answer_template,How is ACE6213 (CyberSecurity) assessed?,Not specified in the provided FAIE course catalog excerpt.
1557,ACE6213-06,faie_full_qa.jsonl,,ACE6213,cut_or_rewrite,placeholder_or_non_answer;repeated_answer_template,What are the contact hours for ACE6213 (CyberSecurity)?,Not specified in the provided FAIE course catalog excerpt.
1558,ACE6213-07,faie_full_qa.jsonl,,ACE6213,cut_or_rewrite,placeholder_or_non_answer;repeated_answer_template,What key contents/topics are covered in ACE6213 (CyberSecurity)?,Not specified in the provided FAIE course catalog excerpt.
1559,ACE6213-08,faie_full_qa.jsonl,,ACE6213,review,repeated_answer_template,Is ACE6213 (CyberSecurity) more theory-based or includes practical/lab work?,The catalog excerpt indicates laboratory/practical components where listed under assessment or contact hours. Specific lab/practical details are not clearly stated in the excerpt.
1560,ACE6213-09,faie_full_qa.jsonl,,ACE6213,review,repeated_answer_template,What skills or outcomes can a student expect from ACE6213 (CyberSecurity)?,"To provide students with comprehensive knowledge of cybersecurity principles, threats, and defense mechanisms."
1561,ACE6213-10,faie_full_qa.jsonl,,ACE6213,cut_or_rewrite,low_user_value_question,Where in the original PDF is ACE6213 (CyberSecurity) listed?,Original PDF page(s) recorded in the cleaned catalog: 9
1562,ACE6223-01,faie_full_qa.jsonl,,ACE6223,review,repeated_answer_template,What is ACE6223 (Multimedia Technology and Applications) about?,"To provide students with knowledge of multimedia technologies, applications, and development."
1563,ACE6223-02,faie_full_qa.jsonl,,ACE6223,review,too_short_answer;repeated_answer_template;numeric_answer_needs_context,How many credits is ACE6223 (Multimedia Technology and Applications)?,3
1564,ACE6223-03,faie_full_qa.jsonl,,ACE6223,cut_or_rewrite,placeholder_or_non_answer;repeated_answer_template,What are the prerequisites for ACE6223 (Multimedia Technology and Applications)?,No prerequisites were detected in the catalog excerpt.
1565,ACE6223-04,faie_full_qa.jsonl,,ACE6223,review,repeated_answer_template,What is the main objective of ACE6223 (Multimedia Technology and Applications)?,"To provide students with knowledge of multimedia technologies, applications, and development."
1566,ACE6223-05,faie_full_qa.jsonl,,ACE6223,keep,,How is ACE6223 (Multimedia Technology and Applications) assessed?,"Test/Quiz: 20%, Project: 30%, Final Examination: 50% Laboratory: Image and video processing labs Course Image fundamentals, image enhancement, image restoration, image"
1567,ACE6223-06,faie_full_qa.jsonl,,ACE6223,review,repeated_answer_template,What are the contact hours for ACE6223 (Multimedia Technology and Applications)?,"44 hours (lectures, tutorials and laboratory experiments)"
1568,ACE6223-07,faie_full_qa.jsonl,,ACE6223,keep,,What key contents/topics are covered in ACE6223 (Multimedia Technology and Applications)?,"compression, image segmentation, feature extraction, video processing, video compression, applications. Course Learning CO1 – Understand image and video processing concepts (cognitive –"
1569,ACE6223-08,faie_full_qa.jsonl,,ACE6223,review,repeated_answer_template,Is ACE6223 (Multimedia Technology and Applications) more theory-based or includes practical/lab work?,The catalog excerpt indicates laboratory/practical components where listed under assessment or contact hours. This excerpt includes lab/practical mentions.
1570,ACE6223-09,faie_full_qa.jsonl,,ACE6223,review,repeated_answer_template,What skills or outcomes can a student expect from ACE6223 (Multimedia Technology and Applications)?,"To provide students with knowledge of multimedia technologies, applications, and development."
1571,ACE6223-10,faie_full_qa.jsonl,,ACE6223,cut_or_rewrite,low_user_value_question,Where in the original PDF is ACE6223 (Multimedia Technology and Applications) listed?,"Original PDF page(s) recorded in the cleaned catalog: 10, 12"
1572,ACE6233-01,faie_full_qa.jsonl,,ACE6233,review,repeated_answer_template,What is ACE6233 (Artificial Intelligence Systems and Applications) about?,"To provide students with knowledge of artificial intelligence concepts, techniques, and applications."
1573,ACE6233-02,faie_full_qa.jsonl,,ACE6233,review,too_short_answer;repeated_answer_template;numeric_answer_needs_context,How many credits is ACE6233 (Artificial Intelligence Systems and Applications)?,3
1574,ACE6233-03,faie_full_qa.jsonl,,ACE6233,cut_or_rewrite,placeholder_or_non_answer;repeated_answer_template,What are the prerequisites for ACE6233 (Artificial Intelligence Systems and Applications)?,No prerequisites were detected in the catalog excerpt.
1575,ACE6233-04,faie_full_qa.jsonl,,ACE6233,review,repeated_answer_template,What is the main objective of ACE6233 (Artificial Intelligence Systems and Applications)?,"To provide students with knowledge of artificial intelligence concepts, techniques, and applications."
1576,ACE6233-05,faie_full_qa.jsonl,,ACE6233,keep,,How is ACE6233 (Artificial Intelligence Systems and Applications) assessed?,"Test/Quiz: 20%, Project: 30%, Final Examination: 50% Laboratory: Machine learning development and experimentation labs Course Machine learning fundamentals, supervised learning, unsupervised"
1577,ACE6233-06,faie_full_qa.jsonl,,ACE6233,review,repeated_answer_template,What are the contact hours for ACE6233 (Artificial Intelligence Systems and Applications)?,"44 hours (lectures, tutorials and laboratory experiments)"
1578,ACE6233-07,faie_full_qa.jsonl,,ACE6233,keep,,What key contents/topics are covered in ACE6233 (Artificial Intelligence Systems and Applications)?,"learning, reinforcement learning, neural networks, feature engineering, model evaluation, ML applications and tools."
1579,ACE6233-08,faie_full_qa.jsonl,,ACE6233,review,repeated_answer_template,Is ACE6233 (Artificial Intelligence Systems and Applications) more theory-based or includes practical/lab work?,The catalog excerpt indicates laboratory/practical components where listed under assessment or contact hours. This excerpt includes lab/practical mentions.
1580,ACE6233-09,faie_full_qa.jsonl,,ACE6233,review,repeated_answer_template,What skills or outcomes can a student expect from ACE6233 (Artificial Intelligence Systems and Applications)?,"To provide students with knowledge of artificial intelligence concepts, techniques, and applications."
1581,ACE6233-10,faie_full_qa.jsonl,,ACE6233,cut_or_rewrite,low_user_value_question,Where in the original PDF is ACE6233 (Artificial Intelligence Systems and Applications) listed?,"Original PDF page(s) recorded in the cleaned catalog: 10, 11, 15"
1582,ACE6243-01,faie_full_qa.jsonl,,ACE6243,review,repeated_answer_template,What is ACE6243 (Java Technology) about?,To teach students Java programming language and development using enterprise technologies.
1583,ACE6243-02,faie_full_qa.jsonl,,ACE6243,review,too_short_answer;repeated_answer_template;numeric_answer_needs_context,How many credits is ACE6243 (Java Technology)?,3
1584,ACE6243-03,faie_full_qa.jsonl,,ACE6243,cut_or_rewrite,placeholder_or_non_answer;repeated_answer_template,What are the prerequisites for ACE6243 (Java Technology)?,No prerequisites were detected in the catalog excerpt.
1585,ACE6243-04,faie_full_qa.jsonl,,ACE6243,review,repeated_answer_template,What is the main objective of ACE6243 (Java Technology)?,To teach students Java programming language and development using enterprise technologies.
1586,ACE6243-05,faie_full_qa.jsonl,,ACE6243,keep,,How is ACE6243 (Java Technology) assessed?,"Test/Quiz: 20%, Design Project: 30%, Final Examination: 50% Laboratory: Advanced Java design labs Course Design patterns, SOLID principles, architectural patterns, refactoring,"
1587,ACE6243-06,faie_full_qa.jsonl,,ACE6243,review,repeated_answer_template,What are the contact hours for ACE6243 (Java Technology)?,"44 hours (lectures, tutorials and laboratory experiments)"
1588,ACE6243-07,faie_full_qa.jsonl,,ACE6243,keep,,What key contents/topics are covered in ACE6243 (Java Technology)?,"testing and debugging, performance optimization, advanced Java features, enterprise design patterns."
1589,ACE6243-08,faie_full_qa.jsonl,,ACE6243,review,repeated_answer_template,Is ACE6243 (Java Technology) more theory-based or includes practical/lab work?,The catalog excerpt indicates laboratory/practical components where listed under assessment or contact hours. This excerpt includes lab/practical mentions.
1590,ACE6243-09,faie_full_qa.jsonl,,ACE6243,review,repeated_answer_template,What skills or outcomes can a student expect from ACE6243 (Java Technology)?,To teach students Java programming language and development using enterprise technologies.
1591,ACE6243-10,faie_full_qa.jsonl,,ACE6243,cut_or_rewrite,low_user_value_question,Where in the original PDF is ACE6243 (Java Technology) listed?,"Original PDF page(s) recorded in the cleaned catalog: 11, 13"
1592,ACE6253-01,faie_full_qa.jsonl,,ACE6253,review,repeated_answer_template,What is ACE6253 (Digital Image and Video Processing) about?,To provide students with knowledge of digital image and video processing techniques and applications.
1593,ACE6253-02,faie_full_qa.jsonl,,ACE6253,review,too_short_answer;repeated_answer_template;numeric_answer_needs_context,How many credits is ACE6253 (Digital Image and Video Processing)?,3
1594,ACE6253-03,faie_full_qa.jsonl,,ACE6253,cut_or_rewrite,placeholder_or_non_answer;repeated_answer_template,What are the prerequisites for ACE6253 (Digital Image and Video Processing)?,No prerequisites were detected in the catalog excerpt.
1595,ACE6253-04,faie_full_qa.jsonl,,ACE6253,review,repeated_answer_template,What is the main objective of ACE6253 (Digital Image and Video Processing)?,To provide students with knowledge of digital image and video processing techniques and applications.
1596,ACE6253-05,faie_full_qa.jsonl,,ACE6253,cut_or_rewrite,placeholder_or_non_answer;repeated_answer_template,How is ACE6253 (Digital Image and Video Processing) assessed?,Not specified in the provided FAIE course catalog excerpt.
1597,ACE6253-06,faie_full_qa.jsonl,,ACE6253,cut_or_rewrite,placeholder_or_non_answer;repeated_answer_template,What are the contact hours for ACE6253 (Digital Image and Video Processing)?,Not specified in the provided FAIE course catalog excerpt.
1598,ACE6253-07,faie_full_qa.jsonl,,ACE6253,cut_or_rewrite,placeholder_or_non_answer;repeated_answer_template,What key contents/topics are covered in ACE6253 (Digital Image and Video Processing)?,Not specified in the provided FAIE course catalog excerpt.
1599,ACE6253-08,faie_full_qa.jsonl,,ACE6253,review,repeated_answer_template,Is ACE6253 (Digital Image and Video Processing) more theory-based or includes practical/lab work?,The catalog excerpt indicates laboratory/practical components where listed under assessment or contact hours. Specific lab/practical details are not clearly stated in the excerpt.
1600,ACE6253-09,faie_full_qa.jsonl,,ACE6253,review,repeated_answer_template,What skills or outcomes can a student expect from ACE6253 (Digital Image and Video Processing)?,To provide students with knowledge of digital image and video processing techniques and applications.
1601,ACE6253-10,faie_full_qa.jsonl,,ACE6253,cut_or_rewrite,low_user_value_question,Where in the original PDF is ACE6253 (Digital Image and Video Processing) listed?,Original PDF page(s) recorded in the cleaned catalog: 12
1602,ACE6263-01,faie_full_qa.jsonl,,ACE6263,cut_or_rewrite,placeholder_or_non_answer,What is ACE6263 (Embedded IoT Systems and Applications) about?,ACE6263 is a FAIE course titled 'Embedded IoT Systems and Applications'. Not specified in the provided FAIE course catalog excerpt.
1603,ACE6263-02,faie_full_qa.jsonl,,ACE6263,cut_or_rewrite,placeholder_or_non_answer;repeated_answer_template,How many credits is ACE6263 (Embedded IoT Systems and Applications)?,Not specified in the provided FAIE course catalog excerpt.
